id,author,title,contents,imageURL,time
t3_ixn4yd,/u/_captcrunch,[PSA] NEW DISCORD SERVER IS UP! (Read Inside),Probably a weedstocks douchebag who’s salty about losing all their money on ditch weed futures.,https://discord.com/invite/VfGvZFN,Tue Sep 22 13:14:12 2020 UTC
t3_jg42ql,/u/Giacc3d,Death Chocolate Mousse / High Grade Aid / October,Was looking to order this looked great on HGA page. Can’t wait to hear how it smokes.,https://i.imgur.com/8uoSwpV.jpg,Thu Oct 22 17:23:16 2020 UTC
t3_jg5tb5,/u/PrettyDopeKits,Blue Magoo Cookies - Kootenay Botanicals - Late OCT,"Looks- 8/10 super fluffy and Sticky nugs, all on the large size.

Smoke- 8/10  a minty, herbal, pine taste. Similar to the nose but less earth notes when smoking.

High- 8/10 good potency that leans into a more sedating/relaxed body high. Definitely increased my appetite. Could be used for day time or night time. 

Overall quality- 8/10 
Value- 8/10

This was rated as AAA and I feel like it is maybe just a few minor details off from AAAA. 
Had the potency been a little stronger I think it would’ve hit that mark.",/r/MOMpics/comments/jg5tb5/blue_magoo_cookies_kootenay_botanicals_late_oct/,Thu Oct 22 18:49:22 2020 UTC
t3_jg23fh,/u/nevertoomany,Kosher Kush - HSP - Oct 2020,"Kosher pickles are a thing, yes.  More or less a Dill pickle with slightly different ingredients.  

https://thecookful.com/whats-the-difference-between-kosher-pickles-and-dill-pickles/",/r/MOMpics/comments/jg23fh/kosher_kush_hsp_oct_2020/,Thu Oct 22 15:46:28 2020 UTC
t3_jg8yfc,/u/boyp12,⛽🔥,Wrong sub..,/r/MOMpics/comments/jg8yfc/_/,Thu Oct 22 21:22:50 2020 UTC
t3_jg4twa,/u/thechronickid_00,Super Lemon Haze Diamonds & Sauce - The Wholesome Monkey - October 2020,"A few more shots - https://imgur.com/a/v8kwyyr

A very nice colour and consistency to this Super Lemon Haze by Honeydip Extracts. Arriving in one juicy glob containing a multitude of micro diamonds that are swimming in sauce. Extremely easy to handle and scoop up as it's not runny and the sauce holds the diamonds to the dab tool like glue. A tiny bit got up into the plastic seal but it was very minimal and easily gathered.

The smell upon opening the lid was like actual lemon candy or a lemon head to be exact. Very sweet and citrusy and it tasted the exact same when dabbed. It dabbed clean and wasn't necessarily harsh but the vapour it produced was lung expanding and acrid which I've found before with haze strains. Still quite tasty and enjoyable at around 500 on the enail.

An extremely heady and hazy high that's felt right after the first dab. The energetic vibe it offers and tendency to be very talkative can't be ignored as it's super uplifting and social. Definitely sativa dominant in every way with very few physical traits other than a slight relaxation towards the end of the high.",/r/MOMpics/comments/jg4twa/super_lemon_haze_diamonds_sauce_the_wholesome/,Thu Oct 22 18:00:57 2020 UTC
t3_jg8jdl,/u/Dshe595,"Carly's Garden // Candy Land // Oct 2020","This is part of the 1 ounce special deal. The nugs are a bit small but the appeal on the nugs are beautiful, very covered in crystals. There's a bready smell to this one and a smooth hot sweet bread-like taste in the mouth. Good potency, good burn, good taste, good price. Shipped quick and my order came with free sunglasses, rollies, a metal grinder and some sick ass girly socks lol.

Very satisfied overall, the weed is great for the price but the whole bundle was amazing. Overall, I'd give this order 10/10. 

The sunglasses are too tight for my face though but it's a great gesture. The grinder is actually really nice quality but it can only fit about 1 joint worth of weed. Rollies aren't the greatest and tend to run a bit.",/r/MOMpics/comments/jg8jdl/carlys_garden_candy_land_oct_2020/,Thu Oct 22 21:02:17 2020 UTC
t3_jg2xws,/u/rikard93,ACDC and Cannatonic CBD Carts- HGA- September,"This review is not insentive review. This is just me and what I think about these CBD Carts. The green one is Cannatonic. It's a thicker oil but taste great and has great CBD effects. The ACDC on the other hand(red) tasted too terpy and like cherries. Seemed to artificial. I personally didn't enjoy it as well as the Cannatonic. 
ACDC: Q-5 V-9
Cannatonic: Q-9 V-10",/r/MOMpics/comments/jg2xws/acdc_and_cannatonic_cbd_carts_hga_september/,Thu Oct 22 16:27:54 2020 UTC
t3_jg0u3c,/u/cannadatrees,Meat breath smalls - HGA - Oct/20,"There’s no conclusive study so it’s basically one’s opinion. I think If it’s not harsh and it tastes fine, then black ash is a minor concern; probably moisture content or the papers. Some people are super hung up on it though.",/r/MOMpics/comments/jg0u3c/meat_breath_smalls_hga_oct20/,Thu Oct 22 14:39:02 2020 UTC
t3_jg7x6u,/u/royal-craft,UBC Chemo from Primative Exotics (October 2020),Very happy with my purchase of UBC Chemo. For 160 an oz this is very fair. The flowers are fairly sticky and gassy. I will be returning to this IG MoM..,/r/MOMpics/comments/jg7x6u/ubc_chemo_from_primative_exotics_october_2020/,Thu Oct 22 20:31:43 2020 UTC
t3_jg174u,/u/leafsin5,Strawberries N’ Cream - Primitive Exotics - Mid October,"The bag appeal of this one is off the charts. The outside of the nugs are completely caked with crystals and the inside isnt much different. The smell right out of the bag was crazy pungent with hints of pine and a sweet finish. It smoked smooth and the taste was very clean and finished with hints of citrus. the high was very social yet very strong, and made you just want to sit around the tv and shoot the shit with the fellas. Overall i give this bud a 9.68/10 as it very easily could be some of the nicest bud ive ever seen (with my own eyes) or smoked.

edit: spelling",/r/MOMpics/comments/jg174u/strawberries_n_cream_primitive_exotics_mid_october/,Thu Oct 22 14:58:46 2020 UTC
t3_jg1uew,/u/Garmacflip,Red Congo (smalls) HGA early October,"This stuff smells like lemon candy; beauty smell. There’s a fair bit of leaf left on these but that was in the disclaimer. Had some popcorn but a lot of small buds too, the small buds being real dense and covered in trichomes. Smokes a tad dark cuz of the leaf but it doesn’t affect the taste or buzz at all. These little nugs give a super daytime high with no burnout whatsoever. This has become one of my top daytime smokes very quickly. Love this stuff.
Quality 8/10 value 10/10",/r/MOMpics/comments/jg1uew/red_congo_smalls_hga_early_october/,Thu Oct 22 15:33:15 2020 UTC
t3_jg84cz,/u/Stonerscotian1,Dead North Crumble - Shades of Green - October 2020,"Beautiful light yellow beige color with a moderated dank like skunky fruityness aroma. Has a earwax like consistency. Had a tasty delicious taste that lingered for a good while. 

A highly potent concentrate, thats sedating. Vauled at 25 a g

Quality - 8.8
Value - 8.8",/r/MOMpics/comments/jg84cz/dead_north_crumble_shades_of_green_october_2020/,Thu Oct 22 20:41:43 2020 UTC
t3_jg49rh,/u/frankieq10,Dino Wizard - Weed Posters - October,Got off them once got cookies n cream it was bomb  but the price... was looking at PINK Zombie but idk,/r/MOMpics/comments/jg49rh/dino_wizard_weed_posters_october/,Thu Oct 22 17:33:07 2020 UTC
t3_jg9fzo,/u/GalloDe_Oro,Big Buffalo Breath - TheChronfather - October 2020,,http://imgur.com/a/CJbk5Q1,Thu Oct 22 21:47:54 2020 UTC
t3_jg8q18,/u/B2M3T02,Earth Bind Cookies - High grade aid - Early October,"Paid 170 for the oz on sale from 210, insanely smooth abs easy smoke, just as potent as DMC, super nice flush there is 0 harshness in the smoke, very good deal at 170 with 25$ off but still a good buy at 210 with 25$ off, another amazing order from HGA they have been my go to since my first order. Message me for referral for 25$ off",/r/MOMpics/comments/jg8q18/earth_bind_cookies_high_grade_aid_early_october/,Thu Oct 22 21:11:07 2020 UTC
t3_jg6c4m,/u/Garmacflip,Peyote sunset chronfather mid/late October,"Good price and quality. Not huge fan of his communication but seriously, it's good shit.",/r/MOMpics/comments/jg6c4m/peyote_sunset_chronfather_midlate_october/,Thu Oct 22 19:13:59 2020 UTC
t3_jg918u,/u/jerc82,"Pink Bubba, HGA, Oct 22.","Wow what a very nice strain the Pink Bubba AAAA from HGA, I got this one on sale for $98 for 14gs.

Upon first arrival I got hit with a great nose of pink Kush, followed up with more of a Piney smell so the nose is on point, bag of peels nice colors beautiful a little bit leafy but I don't mind that, I thought the buds could have been a little bigger and they came to little squished which is something to look into for HGA, Eazy fix tho.

This bud hit's hard smells great it's definitely a true quad and I would buy it again next time it comes on sale as I can afford $280 for a OZ, so I hunt for value and HGA get alot of my orders.",/r/MOMpics/comments/jg918u/pink_bubba_hga_oct_22/,Thu Oct 22 21:26:57 2020 UTC
t3_jg5t1i,/u/MCDaddy75,Do-Si-Dos (Private Reserve Collection) - Mailbox Marijuana - October,"Do-Si-Dos (Private Reserve Collection) from Mailbox Marijuana

Visual: This one was very nice looking as well! There were some bright greens and dark greens and some dark purple leaves. There was lots of sparkly crystal and it looked a bit dank. It was very dense but I could still squish it. It had a good moisture level.   

Nose: The nose was very piney and sweet with some gas to it.

Cut/Roll/Grind: I could feel the stickiness of it while cutting it. It was easy to bust up.

Taste: There was tons of flavour! There was lots of pine and gas and a spicy skunk to it.

Burn: The burn was great! It was nice and slow and steady.

Potency/Effects: Another amazing one! I got a big punch in my nose from this one and the potency built up fast and to a very good level for me. It had a great buzzy effect. I could definitely hang out on the couch with this Do-Si-Dos!

Overall score – 9.7/10

You can watch the video review:

On Youtube:  https://www.youtube.com/watch?v=4Ou2hr6AuKk&t=144s

Or on Instagram: https://www.instagram.com/p/CGp04mNiXcH/",/r/MOMpics/comments/jg5t1i/dosidos_private_reserve_collection_mailbox/,Thu Oct 22 18:49:01 2020 UTC
t3_jfy5n6,/u/BreedWeed85,Tire Fire 🔥🔥🔥 - Subsidiumsecreto - Oct 22nd,Whoa looks bomb,/r/MOMpics/comments/jfy5n6/tire_fire_subsidiumsecreto_oct_22nd/,Thu Oct 22 11:52:42 2020 UTC
t3_jg8ikc,/u/Dshe595,"Carly's Garden // Laughing Buddha // Oct 2020",,/r/MOMpics/comments/jg8ikc/carlys_garden_laughing_buddha_oct_2020/,Thu Oct 22 21:01:12 2020 UTC
t3_jg2h94,/u/Garmacflip,Red Congo HGA late September,"These buds are so sweet and citrus. It’s almost like a Dr Pepper smell. The buds are super tight and trimmed great, there were a couple of leaves but nothing to complain about. Covered in trichomes, these buds burn great. The buzz is super uplifting and is great for the daytime. Super wake and bake strain. Cured to perfection, this bud has a big price tag but is definitely a special offering. Quality 9.5/10 value 8.7/10 big price tag",/r/MOMpics/comments/jg2h94/red_congo_hga_late_september/,Thu Oct 22 16:05:17 2020 UTC
t3_jg85nj,/u/Tempex6,Blue OG Sherbert - Tegridy Farms Cannabis - October Week 3,"First Impressions - Very very dense and styrofoam feel, I thought I got a half-ounce at first look but after weighing it is 28 grams, the photo of the buds is 7 grams alone. Super frosty, upon pulling it out of the bag trichromes fell off like snow. The smell is really nice, not going to compare it to real smells but it smells like a flower, a really nice and relaxing aroma, it doesn't have a skunk smell and it isn't so dank that it fills up your entire room with smell. The look of the bud is good but probably it's lowest trait, it's not brown but the red/orange hairs make it look a little brown, there are lots of sugar leaves that hug the bud really tightly (you can see in the pic) so they were worth leaving otherwise trimming would have taken off to much, still not the greatest thing though.  

Smoke - To be added.. btw this is a $120 ounce.. crazy good quality for the price, I think the only reason this isn't a higher price is how leafy it is.",/r/MOMpics/comments/jg85nj/blue_og_sherbert_tegridy_farms_cannabis_october/,Thu Oct 22 20:43:30 2020 UTC
t3_jg57p5,/u/twentypastfour11,Sugarcane-TheChronFather-Oct.22/20,Review posted. But to answer your question smell/taste is sugary almost like vanilla would be the best way to describe it.,/r/MOMpics/comments/jg57p5/sugarcanethechronfatheroct2220/,Thu Oct 22 18:20:12 2020 UTC
t3_jg3y7h,/u/kashmirs_tiger,Zombie - enigma / cannapanda - oct 22,"Smells like a bit of pine and dank kush mixed, got mostly medium nugs w a few smalls. Covered in crystals and aesthetically a very beautiful drop, great terps, smooth ass tokes, i like the potency its deff on the higher side. Overall a good drop for a good price.
Won’t lie tho the high makes me v lazy.

Q 8.2/10

V 8.3/10",/r/MOMpics/comments/jg3y7h/zombie_enigma_cannapanda_oct_22/,Thu Oct 22 17:17:01 2020 UTC
t3_jfx9oq,/u/cannabisbigbrother,Mango Lemonade - P&C - Oct 13 2020,Definitely not cheap at all !! Hurts my pocket book for-sure. I rarely share this flower with others and it’s a treat for myself. Mostly evening to bed I enjoy these.,/r/MOMpics/comments/jfx9oq/mango_lemonade_pc_oct_13_2020/,Thu Oct 22 10:41:44 2020 UTC